### ISSUE TITLE
Server broke tcp connection with RST flag

### ISSUE THREAD

**Issue by PheonixS** [LTD-Beget/syncookied#25]
We trying to use Syncookied on test env and have trouble with connection.
telnet trying to connect to opened 80 port on Protected server, but unsuccessfully.

Transition of the client session:

```
tcpdump: verbose output suppressed, use -v or -vv for full protocol decode
listening on venet0, link-type LINUX_SLL (Linux cooked), capture size 65535 bytes
11:05:33.316435 IP 92.63.98.40.36798 > 89.111.56.136.http: Flags [S], seq 3208781071, win 14600, options [mss 1460,sackOK,TS val 1624259346 ecr 0,nop,wscale 8], length 0
11:05:33.383044 IP 89.111.56.136.http > 92.63.98.40.36798: Flags [S.], seq 369175399, ack 3208781072, win 65535, options [mss 1460,sackOK,TS val 437399 ecr 1624259346,nop,wscale 7], length 0
11:05:33.383083 IP 92.63.98.40.36798 > 89.111.56.136.http: Flags [.], ack 1, win 58, options [nop,nop,TS val 1624259413 ecr 437399], length 0
11:05:33.446237 IP 89.111.56.136.http > 92.63.98.40.36798: Flags [R], seq 369175400, win 0, length 0
```

Firewall running Syncookied with arguments `syncookied -i eth0 -c /etc/syncookied/hosts.yml -o eth2`

Contents of hosts.yml

```
- ip: 89.111.56.136
  local_ip: 10.10.11.177:1488
  mac: 5e:e2:67:9e:57:c1
  filters:
   tcp and dst port 9081: pass
   tcp and dst port 80: pass
   tcp and dst port 22: drop
   default: drop
```

Transition of Firewall session:

```
tcpdump: verbose output suppressed, use -v or -vv for full protocol decode
listening on eth0, link-type EN10MB (Ethernet), capture size 262144 bytes
11:07:21.648426 IP 92.63.98.40.55916 > 89.111.56.136.80: Flags [S], seq 183530866, win 14600, options [mss 1460,sackOK,TS val 1624367227 ecr 0,nop,wscale 8], length 0
11:07:21.709491 IP 92.63.98.40.55916 > 89.111.56.136.80: Flags [.], ack 973748478, win 58, options [nop,nop,TS val 1624367288 ecr 464407], length 0
```

Transition of Protected server session:

```
tcpdump: verbose output suppressed, use -v or -vv for full protocol decode
listening on any, link-type LINUX_SLL (Linux cooked), capture size 262144 bytes
11:07:21.747190 IP 92.63.98.40.55916 > 89.111.56.136.80: Flags [.], ack 973748478, win 58, options [nop,nop,TS val 1624367288 ecr 464407], length 0
11:07:21.747255 IP 89.111.56.136.80 > 92.63.98.40.55916: Flags [R], seq 973748478, win 0, length 0
```

Opened ports on Protected server:

```
State      Recv-Q Send-Q                                                  Local Address:Port                                                    Peer Address:Port 
LISTEN     0      5                                                           127.0.0.1:53                                                                 *:*     
LISTEN     0      128                                                                :::22                                                                :::*     
LISTEN     0      128                                                                 *:22                                                                 *:*      
LISTEN     0      1                                                                   *:80                                                                 *:*  
```

Content of /proc/tcp_secrets on Protected server:

```
4295469164 286364 250
07612fc7.eca943e4.072eabf9.429ddef1.eae04bcc.68cf7123.3d326366.ab0719ee.e6083207.d9b3f2af.eac58f40.2d7b6011.fe5ec306.214a71cb.e75566bb.631b1295.0b0298e6.
439aacec.9a5eca30.de5bb1d9.5af5d652.b609bada.2469f79c.55e4b2ba.f0ca7737.ad545720.5f83ae96.5badb7a0.e71e693a.4b35c6cb.7d61c477.23145335.96bc2b77.6ca1e633.

```

Protected server `Linux xen-photo-cache1 4.6.0-0.bpo.1-amd64 #1 SMP Debian 4.6.4-1~bpo8+1 (2016-08-11) x86_64 GNU/Linux
`
Firewall server `Linux pheonixs-test4 4.6.0-0.bpo.1-amd64 #1 SMP Debian 4.6.4-1~bpo8+1 (2016-08-11) x86_64 GNU/Linux
`

Also on Router we have static arp binding: `89.111.56.136<->18:03:73:ef:67:56`

Ifconfig of Firewall:

```

1: lo: <LOOPBACK,UP,LOWER_UP> mtu 65536 qdisc noqueue state UNKNOWN group default qlen 1
    link/loopback 00:00:00:00:00:00 brd 00:00:00:00:00:00
    inet 127.0.0.1/8 scope host lo
       valid_lft forever preferred_lft forever
2: eth0: <BROADCAST,MULTICAST,UP,LOWER_UP> mtu 1500 qdisc netmap_generic state UP group default qlen 1000
    link/ether 18:03:73:ef:67:56 brd ff:ff:ff:ff:ff:ff
3: eth1: <BROADCAST,MULTICAST,UP,LOWER_UP> mtu 1500 qdisc mq state UP group default qlen 1000
    link/ether 18:03:73:ef:67:58 brd ff:ff:ff:ff:ff:ff
    inet 10.10.10.52/22 brd 10.10.11.255 scope global eth1
       valid_lft forever preferred_lft forever
4: eth2: <BROADCAST,MULTICAST,UP,LOWER_UP> mtu 1500 qdisc netmap_generic state UP group default qlen 1000
    link/ether 18:03:73:ef:67:5a brd ff:ff:ff:ff:ff:ff
5: eth3: <BROADCAST,MULTICAST> mtu 1500 qdisc noop state DOWN group default qlen 1000
    link/ether 18:03:73:ef:67:5c brd ff:ff:ff:ff:ff:ff

```

Ifconfig of Protected Server:

```
1: lo: <LOOPBACK,UP,LOWER_UP> mtu 65536 qdisc noqueue state UNKNOWN qlen 1
    link/loopback 00:00:00:00:00:00 brd 00:00:00:00:00:00
    inet 127.0.0.1/8 scope host lo
       valid_lft forever preferred_lft forever
2: eth0: <BROADCAST,MULTICAST,UP,LOWER_UP> mtu 1500 qdisc mq state UP qlen 1000
    link/ether 5e:e2:67:9e:57:c1 brd ff:ff:ff:ff:ff:ff
    inet 89.111.56.136/24 brd 89.111.56.255 scope global eth0
       valid_lft forever preferred_lft forever
3: eth1: <BROADCAST,MULTICAST,UP,LOWER_UP> mtu 1500 qdisc mq state UP qlen 1000
    link/ether 82:04:8f:be:ce:27 brd ff:ff:ff:ff:ff:ff
    inet 10.10.11.177/22 brd 10.10.11.255 scope global eth1
       valid_lft forever preferred_lft forever


```

**Comment by PheonixS** [comment]
I found an error in our env.
Something of sysctl options what we set affect the tcp stack.
This options are set:

```
fs.inotify.max_user_watches = 65536
net.core.netdev_max_backlog = 2500
net.core.rmem_max = 16777216
net.core.somaxconn = 10000
net.core.wmem_max = 16777216
net.ipv4.conf.all.arp_announce = 2
net.ipv4.conf.all.arp_ignore = 1
net.ipv4.conf.all.promote_secondaries = 1
net.ipv4.conf.all.rp_filter = 0
net.ipv4.conf.default.promote_secondaries = 1
net.ipv4.conf.eth0.arp_announce = 2
net.ipv4.conf.eth0.arp_ignore = 1
net.ipv4.icmp_echo_ignore_broadcasts = 1
net.ipv4.ip_local_port_range = 1024 65000
net.ipv4.tcp_fin_timeout = 10
net.ipv4.tcp_keepalive_intvl = 30
net.ipv4.tcp_keepalive_probes = 3
net.ipv4.tcp_keepalive_time = 300
net.ipv4.tcp_max_syn_backlog = 4096
net.ipv4.tcp_orphan_retries = 1
net.ipv4.tcp_rmem = 4096 87380 16777216
net.ipv4.tcp_synack_retries = 3
net.ipv4.tcp_syncookies = 1
net.ipv4.tcp_window_scaling = 0
net.ipv4.tcp_wmem = 4096 65536 16777216
net.ipv6.conf.all.disable_ipv6 = 1
net.ipv6.conf.default.disable_ipv6 = 1
net.ipv6.conf.eth0.disable_ipv6 = 1
net.ipv6.conf.eth1.disable_ipv6 = 1
net.ipv6.conf.lo.disable_ipv6 = 1

vm.lowmem_reserve_ratio = 32 32 4
vm.swappiness = 0

```

After reset the sysctl configuration to default state and reboot, syncookied is work.

**Comment by PheonixS** [comment]
`net.ipv4.tcp_window_scaling = 0`
affect incoming tcp session!

**Comment by polachok** [comment]
Glad you found the solution yourself. We'll try to improve documentation. I started a wiki at https://github.com/LTD-Beget/syncookied/wiki
